Category,Name,Neighborhood,Recognition,What_to_order,Price_range,Reservation,Best_time,Notes
Michelin,Disfrutar,L'Antiga Esquerra de l'Eixample,★★★ since 2024 · World's 50 Best #1 in 2024 · Michelin Green Star,"the tasting menu only — 30+ courses of textural illusions, ferments, and Mediterranean reinvention",EUR 315 menu (pairing +150–200),Essential — book 10–12 months ahead,Dinner Tue–Sat,"Xatruch + Castro + Casañas, all senior elBulli alumni. The hardest table in Spain. Closed Sun–Mon. The 'false dishes' (one thing tastes of another) are the signature trick."
Michelin,Lasarte,La Dreta de l'Eixample,★★★ (Martín Berasategui's Barcelona satellite under Paolo Casagrande),"the dinner tasting; or the weekday lunch (€225) — better value, same kitchen",EUR 345 dinner / EUR 225 lunch,"Essential, weeks ahead, dress code",Weekday lunch,"Inside the 5GL Monument Hotel. The 'Il Milione' private counter (8 seats, kitchen-front) is bookable separately. Berasategui himself doesn't cook here — Casagrande does."
Michelin,Enigma,Sant Antoni / Eixample border,★★ (promoted from ★ in November 2025 — the news of the 2026 guide),the 25-course tasting; dishes are not named until after you eat them,EUR 280 menu,"Wed–Fri eves only, book via enigmaconcept.es",Wednesday evening,"Albert Adrià — Ferran's brother, the elBarri group founder. Bodega 1900, Tickets, Pakta, Hoja Santa all closed in 2020; Enigma was the sole survivor. Now promoted to ★★ and the elBulli legacy lives most directly here."
Michelin,Cocina Hermanos Torres,Les Corts,★★★ + Michelin Green Star — the only triple-star in Barcelona with the sustainability award,"the theatrical tasting menu — three open cooking stations in the centre of the converted industrial space, you eat surrounded by the kitchen",EUR 310 menu,"Essential, months ahead — phone Mon–Fri 10–12 / 18–20",Dinner,Sergio + Javier Torres. Single most photogenic dining room of any starred restaurant in the city. The artichoke with truffle is canonical.
Michelin,Mont Bar,L'Eixample,★★ (promoted from ★ in November 2025 — most discussed promotion of the 2026 guide),sobrasada and Mahón cheese mochi; the sea-cucumber 'carbonara'; the creative pintxo opening series,EUR 190–240,Essential — counter seats are kitchen-front,Dinner,"Chef Fran Agudo, ex-Tickets (elBarri). The gastrobar format reaches ★★ — a Barcelona statement."
Michelin,Aleia,Passeig de Gràcia (Hotel Casa Fuster),★★ (promoted from ★ in November 2025),the ingredient-led seasonal tasting — pared-back plates that let produce speak,EUR 200 menu,Via hotel or TheFork,Dinner,"Chefs Paulo Airaudo (Italo-Argentine) + Rafa de Bedoya (Jerez). Inside Hotel Casa Fuster, a 1908 Domènech i Montaner Modernista building."
Contemporary,Bar Cañete,El Raval,Michelin recommended — the canonical Raval table,"anchoas de Santoña (Cantabrian anchovies), gamba de Palamós (the great prawn — €19–22), fideuà Cañete, the pa amb tomàquet",EUR 35–55,Essential at dinner; counter seats for the kitchen view,Lunch Thu–Sat,Two blocks from the Liceu. The ringside counter is the best seat. Tapas €5–20 each.
Contemporary,Cinc Sentits,La Nova Esquerra de l'Eixample,★ — small-producer Catalan,"the Tasting (longer) or Essence (shorter) menu — pa amb tomàquet sequence, Penedès wine pairing",EUR 185–219,Book 3–4 weeks ahead at cincsentits.com,Dinner,"Jordi Artal, Canadian-Catalan, self-taught. The relationships with small Catalan producers (cheese, oil, vegetables) are the spine."
Traditional,Can Culleretes,Barri Gòtic,"Founded 1786 — oldest restaurant in Catalonia, second oldest in Spain (Guinness-recognised)","escudella i carn d'olla (the ur-Catalan meat-and-veg stew), botifarra amb mongetes, canelons d'espinacs amb brandada de bacallà, civet de porc senglar, crema catalana",EUR 25–35 / menu del dia EUR 15–18,Recommended weekends,Lunch Tue–Sun,"Agut Manubens family, continuously since 1786. Bib Gourmand 2026. Closed Monday."
Traditional,7 Portes (Set Portes),Port Vell,Since 1836 — the paella institution; the Paella Parellada was invented here,"Paella Parellada (boneless meat + shellfish, the house classic), arròs amb llagosta, fideuà, suquet de peix",EUR 40,Via 7portes.com,Dinner — the piano sets,Daily 13:00–01:00 (continuous service). The 19th-century vaulted dining room with name-plates of historic patrons is the experience.
Traditional,Quimet & Quimet,Poble Sec,"Founded 1914, fifth-generation Quimet — standing only, tiny, magnificent","montaditos (small open-faced bites on bread — truffled sturgeon roe, smoked salmon with caviar cream, boquerón with anchovy cream); cava or vermut by the glass",EUR 3–5 / montadito · EUR 20–30 standing,Walk-in only — no reservations,Open 12:00–16:00 + 18:00–22:30 Mon–Fri; 12:00–16:00 Sat; closed Sun,Arrive at opening or wait. Cult tinned-seafood selection on the back wall. Cash and card both.
Cult,La Cova Fumada,Barceloneta,"Cash-only, no sign — where la bomba was invented (Civil War era)","la bomba (fried potato sphere holding seasoned meat, paprika dust, allioli + brava sauces), grilled sardines, clams, sepia",EUR 15–25 · bomba EUR 3–4,"Walk-in only — no reservations, no phone bookings","Mon–Fri 09:00–15:30, Sat 09:00–14:30; closed Sun",Family-run on a Barceloneta corner since 1944. Cash only. OAD Casual Europe #81 (2025). The bomba in any other bar is a copy of this one.
Drink,El Xampanyet,El Born,"Cava and anchovy bar since 1929 — three generations of the Esteve family, on the Picasso Museum street","the house cava (lightly sweet, ceramic jug); anchovies from L'Escala; the montaditos; pa amb tomàquet",EUR 2–4 / glass · EUR 15–25 head,Walk-in,Lunch / pre-dinner aperitif,Narrow tile-decorated tavern. Tourist-known but genuinely excellent — the locals come earlier. Closed Sun + Mon.
Traditional,Els Pescadors,Poblenou,The Poblenou seafood benchmark — suquet de peix with authority,"suquet de peix (the fisherman's stew, definitive version), fideuà negra (squid-ink noodles), arròs a banda, fresh grilled catch of the day",EUR 45–65,"Essential weekends, via elspescadors.com",Lunch on the terrace of the old square,Plaça de Prim is the old fishing-village square of Poblenou. The terrace is the reason.
Contemporary,Suculent,El Raval,Michelin recommended — the elBulli-trained reading of Catalan classics,"the 'Los Clásicos' or 'Suculent' sharing menu — reimagined Spanish-Mediterranean classics; octopus, brava, slow-cooked meats",EUR 55–80,Via suculent.com,Dinner,"Chef Toni Romero (elBulli alumni). Casual format, serious cooking."
Market,Mercat de la Boqueria,El Raval (entrance on La Rambla),Founded 1840 on the site of the former Convent of Sant Josep — Barcelona's flagship market,"the back rows (Pinotxo Bar, Bar Central — locals eat here), jamón ibérico bellota, Catalan goat cheeses, salt-cured anchovies, fresh figs and tomatoes in season",EUR variable · the bar counters EUR 12–25,Walk-in,Tue–Sat morning 08:00–11:00 (avoid the lunchtime tourist crush),Closed Sunday. The front-row stalls near La Rambla are tourist-oriented; the real market is at the back.
Market,Mercat de Sant Antoni,Sant Antoni,1882 iron market by Antoni Rovira i Trias — reopened in 2018 after eight years of restoration,the Sunday morning book + collectibles market on the perimeter; the produce inside (Tue–Sat); after-market vermut at Bar Calders one block south,EUR variable,Walk-in,Sunday morning for the books; Tue–Sat for fresh produce,The Sant Antoni vermut neighborhood orbits this market.
Cult,Codorníu,Sant Sadurní d'Anoia — 45 min south by R4 train,"Founded 1551 · birthplace of Cava (1872, Josep Raventós i Fatjó) · cellars by Puig i Cadafalch 1895–1921, Spanish National Monument 1976","the cellar tour through 27 km of underground galleries; tasting of Cava de Paraje Calificado (El Tros Nou, La Pleta, La Fideuera) and the Anna de Codorníu range",EUR 17–35 / visit,Book ahead at codorniu.com — slots fill weekends,Morning tour,"Modernista brick architecture, ribbed cellars, a 27-km labyrinth on three levels. The R4 Renfe from Sants takes 45 minutes. Pair with Recaredo or Gramona by appointment."
